{
  "schema_version": "P1008_T2_RECONCILIATION_V1",
  "reconciliation_id": "T2REC-44838A41BD825DD5-AAAAAAAAAAAA",
  "candidate_id": "T2C-E2E8617A2EFC04E3-643F507A8188",
  "candidate_hash": "44838A41BD825DD53D5C5F4559D1C6212B6A7C87019A670109AB6921AFBA905E",
  "metric_id": "TEST_ESTIMATED_PB_MULTIPLE",
  "period": "2026-09-18",
  "original_point_estimate": "1.905",
  "original_estimate_lower_bound": "1.800",
  "original_estimate_upper_bound": "2.050",
  "unit": "MULTIPLE",
  "replacement_data_tier": "T0_DIRECT_OFFICIAL",
  "replacement_value": "1.910",
  "replacement_source_id": "TEST-OFFICIAL-PB",
  "replacement_source_hash": "AAAAAAAAAAAAAAAAAAAAAAAAAAAAAAAAAAAAAAAAAAAAAAAAAAAAAAAAAAAAAAAA",
  "reconciliation_state": "OFFICIAL_REPLACEMENT_AVAILABLE",
  "recorded_at": "2026-09-19T00:00:00Z",
  "estimate_lineage_retained": true,
  "t2_current_canonical": false,
  "canonical_display_preference": "T0_T1_REPLACEMENT",
  "formal_authority_created": false,
  "formal_scoring_eligible": false,
  "actionable": false
}
